{
  "$schema": "./model_constants.registry.schema.json",
  "registryVersion": "4.1.0",
  "frozenAtCommit": "3bce651",
  "description": [
    "SPEC 5.1 상수 외부화의 계약면. 손으로 쓴 코디네이터 소유 파일이며 생성물이 아니다 (SPEC 9.4).",
    "이 파일은 값의 정본이 아니다. 값의 정본은 store 의 ModelConstant 다.",
    "이 파일이 고정하는 것은 세 가지뿐이다 — (1) 키, (2) 단위·타입, (3) 분류.",
    "frozen_current_value 는 1-① 의 구조 변경이 '판정 숫자를 바꾸지 않았음'을 증명하기 위한",
    "기준값이었고, 1-② 부터는 저장소가 시드하는 현재 값이다. 이름은 1-① 국면의 잔재다.",
    "개수는 이 산문에 적지 않는다 — entries 를 세어라. registryVersion 1.0.0 은 26키였고",
    "1.1.0 에서 인라인 가중치·구간 경계 41키가 더해졌다. 산문에 개수를 박아 두면 반드시 어긋난다",
    "(실제로 어긋났고 W-store 가 잡았다). SPEC Part 0-C 의 '19개'는 산문 오기이며 표는 20행이다."
  ],
  "injectionContract": {
    "$comment": "SPEC 5.1.1 '네 엔진이 각자 다른 방식을 발명하지 않도록 하나의 방식만 쓴다' 의 구체형.",
    "form": "def <entry_point>(*, constants: Mapping[str, ConstantValue], ...) -> dict",
    "constantValueTypes": "float | int | str | Mapping[int, int] | Sequence[str] | Sequence[Mapping[str, Any]]",
    "keyedBy": "이 파일의 entries[].key 문자열",
    "lookupRule": [
      "반드시 constants[key] 로 조회한다. constants.get(key, <default>) 를 금지한다.",
      "SPEC 5.1.1 fail-closed — 조회 실패 시 기본값을 쓰지 않는다. 누락은 KeyError 로 터져야 한다.",
      "전수 존재 검증은 기동 시 별도로 수행한다 (Wave 2, api 소유)."
    ],
    "enginesMayNotImport": "engines 는 store 를 import 하지 않는다 (SPEC 1.2). 매핑은 호출자가 주입한다.",
    "numericType": {
      "decision": "float 유지",
      "$comment": "Decimal 전환은 반올림 경로를 바꿔 판정 숫자를 움직일 수 있고, 1-① 완료 기준('판정 숫자·상태 필드가 1-① 이전과 동일')과 정면 충돌한다. 1-① 은 구조 변경이므로 float 을 유지한다. 통화 반올림 규율은 common.floor_to / money 와 SPEC 9.1.1 골든 픽스처가 담당한다."
    }
  },
  "valueTypeVocabulary": {
    "ratio": "0..1 배수. 코드에서 곱셈에 직접 쓰인다 (예: 0.30).",
    "krw": "원 단위 정수.",
    "krw_by_household": "가구원수(int) -> 원(int) 매핑.",
    "years": "연 단위 정수.",
    "score_points": "점수 척도의 값 — 구간 경계와 가중치 모두. 리스크 0~100, fitScore 0~100.",
    "policy_id_order": "정책 ID 문자열의 우선순위 순서열. 숫자는 아니지만 어느 상품이 매칭되는지를 바꾸므로 SPEC 5.1.2 의 금지 대상('판정 결과의 숫자를 바꾸는 값')에 해당한다.",
    "percent_rate": "퍼센트 포인트이며 사용 시 /100 을 거친다 (3.0 -> 0.03). percent_level 과 섞으면 예선의 80만/81만 부류 단위 사고가 난다.",
    "percent_level": "퍼센트 포인트이며 그대로 비교되거나 응답에 그대로 실린다 (60 은 60% 그 자체). /100 을 거치지 않는다.",
    "guarantee_rate_table": "보증금액 구간 x 주택유형 x 부채비율 -> 연 보증료율(percent_rate). 24행 배열이며 각 행은 {depositMaxKRW, housingType, debtRatioMaxPct, ratePct} 다. depositMaxKRW 와 debtRatioMaxPct 의 null 은 개방 상한(「초과」)을 뜻한다.",
    "lookup_rule": "조회 규칙의 이름. 숫자는 아니지만 표의 어느 칸이 선택되는지를 바꾸므로 SPEC 5.1.2 의 금지 대상('판정 결과의 숫자를 바꾸는 값')에 해당한다.",
    "sido_code_prefixes": "행정표준코드 시도 접두 2자리 문자열의 목록. 지역 코드가 이 중 하나로 시작하면 그 분류에 속한다.",
    "attempts": "시도 횟수의 상한(1 이상 정수). 최초 호출을 포함한다 — 2 는 '최초 1회 + 재시도 1회'다.",
    "multiple": "배수(1.0 = 같음). ratio 와 다르다 — ratio 는 0..1 이고 이쪽은 상한이 없다. 중앙값의 몇 배인지 같은 비교에 쓴다.",
    "count": "건수(0 이상 정수). 표본 수처럼 세는 값이다.",
    "months": "개월 수(1 이상 정수). years 와 섞으면 12배 어긋난다.",
    "sqm": "제곱미터. 전용면적처럼 넓이를 재는 값이다.",
    "seconds": "초(1 이상 정수). 밀리초와 섞지 않는다 — 계약 파일의 타임아웃은 ms 이고 이쪽은 배치 쪽 초 단위다."
  },
  "engineConsumers": {
    "$comment": "★ 이 레지스트리의 항목이 전부 판정 엔진에 조회되는 것은 아니다. SPEC Part 0-E #4 가 (d) 성격의 **운영 임계**(신선도 임계 · 7.3 SLA N일 · 4.5 강등 임계 등)를 '별도 설정 개념을 새로 만들지 않고 ModelConstant + our_choice 로 등재'하라고 명시했고, 그 셋은 전부 엔진이 조회하지 않는다. 그러므로 [엔진이 조회하는 키]와 [등재된 전체 키]는 같지 않으며, 같기를 요구하면 SPEC 보다 좁은 계약이 된다.",
    "engines": ["affordability", "tco", "risk", "eligibility", "engines"],
    "$enginesComment": "SPEC 1.1 의 4대 판정 엔진 + 엔진 공용(engines). 이 목록에 속한 key 의 집합은 engines.required_constant_keys() 와 **정확히 일치해야 한다** — 그 등호가 계약 드리프트 탐지의 본체이며 test_constant_key_sources.py 가 집행한다.",
    "nonEngineConsumers": {
      "extraction": "SPEC 4단계 정책 추출 파이프라인(ingest). 판정 경로가 아니다 — SPEC 원칙 1 에 따라 /api/analyze 는 LLM 을 호출하지 않으므로, 이 소비자의 상수는 판정 숫자를 바꾸지 못한다.",
      "auth": "SPEC 4단계 인증·권한(api). 판정 경로가 아니다 — 세션 수명은 누가 화면을 얼마나 오래 열어 둘 수 있는가를 정할 뿐 판정 숫자에 작용하지 않는다.",
      "ingest": "SPEC 3단계 시세 수집 배치(ingest). 판정 경로가 아니다 — 배치가 저장소에 넣은 **값**은 판정을 바꾸지만, 이 상수들은 [무엇을 어떻게 모을 것인가]를 정할 뿐 이미 저장된 값에는 작용하지 않는다."
    },
    "$sensitivityComment": "비엔진 상수도 spec_class == d 이면 감도분석 전수 대상에 그대로 들어간다 (Part 0-E #4 가 그렇게 요구한다). ★ 다만 표에 무엇이 찍히는지는 실제로 돌려서 확인해야 한다 — extraction.max_attempts 는 현재 값 2 에 교란폭 ±5%·±20% 를 곱해도 정수 한 칸을 못 넘으므로 표에 [교란 불가]로 나온다. [판정 변화 0]이 아니다. 둘은 다른 사실이며(전자는 교란 자체가 성립하지 않았다는 뜻, 후자는 교란했는데 안 바뀌었다는 뜻) sensitivity.py 가 0% 로 뭉개는 것을 거부하는 이유가 그것이다. 이 상수가 판정 경로 밖이라는 사실은 표가 아니라 engineConsumers 가 말한다. 표를 손보거나 억지로 영향을 만들지 않는다."
  },
  "classificationLegend": {
    "a": "법정 계산 — 정답 존재. 추정 금지, 계산으로 대체 (SPEC Part 0-C)",
    "b": "관측 통계 — 인용 + 기준시점 명시",
    "c": "시장 가격 — 관측값 + 기준일 명시, 만기 대응",
    "d": "규범적 선택 — 정답 없음. 우리 선택임을 명시 + 감도분석"
  },
  "seedRule": [
    "W-store 는 이 파일의 entries 를 그대로 ModelConstant 로 시드한다.",
    "(d) 항목은 seed_provenance.verification = our_choice 로 등재된다 — 규범적 선택에는 신선도가 없다 (SPEC 2.4).",
    "(a)(b)(c) 항목은 seed_provenance.verification = unverified 로 등재된다 (SPEC D-14).",
    "따라서 1-① 완료 시 dataGrade 는 정직하게 C 가 된다. 이것이 의도된 상태다.",
    "pending_diligence 에 적힌 준거 후보는 실사 승인 전까지 seed_provenance 에 기재하지 않는다.",
    "  — SPEC Part 0-C 경고: 모집단·기준시점을 밝히지 않은 인용은 심사에서 즉시 반박당한다."
  ],
  "entries": [
    {
      "key": "affordability.housing_cost_ratio_cap",
      "engine": "affordability",
      "legacy_symbol": "HOUSING_COST_RATIO_CAP",
      "spec_class": "d",
      "value_type": "ratio",
      "frozen_current_value": 0.3,
      "spec_action": "RIR 수도권 임차가구 중위수를 준거로 인용하되, 상한값 0.30 은 우리 선택임을 명시 + 감도분석",
      "seed_provenance": {
        "source_kind": "normative",
        "source_name": "국토교통부 2024년도 주거실태조사 — 수도권 임차가구 RIR 중위수 18.4%",
        "source_ref": "https://www.molit.go.kr/USR/NEWS/m_71/dtl.jsp?lcmspage=1&id=95091415",
        "observed_at": null,
        "fetched_at": null,
        "verification": "our_choice"
      },
      "normative_statement": "관측된 수도권 임차가구 RIR 중위수는 18.4%다 (국토부 주거실태조사 2024년도). 우리는 주거비 상한을 30%로 둔다 — 이것은 관측 중위수가 아니라 허용 최대치이며, 관측값보다 높게 잡은 것은 우리 선택이다. 30%라는 수치 자체에 공표 준거는 없다.",
      "$comment": "USER DECISION 2026-08-13. 실사(FINDINGS.md A5)가 모집단 5종을 원문확인했다 — 전국 임차 15.8 / 수도권 임차 18.4 / 광역시 15.2 / 도지역 12.7 / 청년가구 16.0 / 신혼 17.7 / 고령 25.4. SPEC D-4(서울 중심)에 가장 가까운 수도권을 준거로 채택했다. SPEC Part 0-C 가 적은 'RIR 30% 초과 부담 / 50% 초과 과부담' 기준은 2024년도 보도자료에서 출처를 확인하지 못했으므로(FINDINGS.md A5-7) 그 문구를 준거로 인용하지 않는다. pending_diligence 가 아니라 open_questions 를 쓴다 — 전자는 '이 상수의 출처가 아직 승인되지 않았다'는 뜻이고, store 의 test_no_pending_diligence_candidate_leaks_into_provenance 가 그 경우 계보에 source_name 을 적지 못하게 막는다. 여기는 준거가 승인된 경우이므로 그 가드에 걸리면 안 되고, 걸리게 두면 가드의 의미가 흐려진다.",
      "open_questions": "저소득층 RIR (FINDINGS.md A5-6) 미확인 — 2024년도 보도자료에 소득계층별 항목이 없다. 확인되면 준거 모집단을 재검토한다. 채택된 준거(수도권 임차 18.4%) 자체는 원문확인 완료다."
    },
    {
      "key": "affordability.recommended_haircut",
      "engine": "affordability",
      "legacy_symbol": "RECOMMENDED_HAIRCUT",
      "spec_class": "d",
      "value_type": "ratio",
      "frozen_current_value": 0.85,
      "spec_action": "F-2 통합 완료 (1-③). 권장액 상한의 단일 규칙이다 — recommended = max_cost x 0.85. 폐기: affordability.recommended_ratio_cap (0.25).",
      "seed_provenance": {
        "source_kind": "normative",
        "source_name": null,
        "source_ref": null,
        "observed_at": null,
        "fetched_at": null,
        "verification": "our_choice"
      },
      "normative_statement": "권장액은 감당 가능 상한의 85%다. 15%p 라는 안전마진에 공표 준거는 없다 — 우리 선택이다. 소득 대비 비중 상한은 housing_cost_ratio_cap(0.30, RIR 수도권 임차 18.4% 준거)이 단독으로 지며, 이 상수는 그 축을 다시 제한하지 않고 실제로 구속한 상한(비율상한이든 잔여여력이든) 아래로 여유를 둘 뿐이다. 결과적으로 비율상한이 구속하는 구간에서 권장액의 실효 소득비중은 0.30 x 0.85 = 25.5%가 되며, 이 25.5%에도 공표 준거는 없다.",
      "$comment": "F-2 통합 (1-③, W-engines-3 제안 -> 코디네이터 승인 2026-08-14). SPEC Part 0-C F-2 가 지적한 것은 0.30 x 0.85 = 0.255 와 0.25 가 2% 차이로 겹쳐 구간에 따라 각각 유효해진다는 것이었다. 통합 근거는 두 상수가 **같은 축이 아니라는** 것이다 — 소득비중 축은 준거가 있는 housing_cost_ratio_cap 이 이미 단독으로 지고 있었고 recommended_ratio_cap 은 그 위에 얹힌 준거 없는 중복이었다. 이 상수는 다른 축(상한 대비 안전마진)이며 실제로 구속한 상한에 붙으므로 전 구간에서 같은 규칙이 된다. 회귀: 계약 프로필 세트 6건 중 판정 뒤집힘 0건, 숫자 이동 1건 (very_high_income 권장액 7,500,000 -> 7,650,000, +2.0%). 변화 구간은 cap_ratio(=max/net) 0.294~0.30 뿐이고 권장액 이동폭 상한은 소득의 0.5%p 다. || ★ 기각한 안 B — recommended_haircut 을 버리고 recommended_ratio_cap(0.25) 을 남기는 안. 다시 제안하지 말 것. (1) tco.py 의 verdict 는 monthly<=aff_rec 이면 affordable, monthly<=aff_max 면 stretch 인데, 잔여여력이 세게 구속하는 구간에서 안 B 는 권장액을 상한과 같게 만든다 (net 2,000,000 -> max 260,000 / 권장 260,000). 그 순간 **stretch 분기가 도달 불가능**해지고 3분류가 조용히 2분류가 된다. (2) 그 구간은 1-② 이후 **다수 구간**이다 — 생활비가 공표값으로 오르면서 구속 제약이 비율상한에서 잔여여력으로 옮겨갔다 (감도분석: housing_cost_ratio_cap +20% 판정뒤집힘 67% -> 0%, buffer_ratio 0% -> 67%). (3) 저소득 가구에서 권장액이 느슨해지는 방향이라 계약 결정 #11 의 「첫 집 지불능력 도구에서 틀릴 방향으로는 관대한 쪽」에 정면으로 걸린다. || 감도분석에서의 위치 (SPEC 5.1.3): 통합 전 -20% 큰 폭에서 이 상수는 67% 를 뒤집었고 recommended_ratio_cap 은 17% 만 뒤집었다 — 권장액을 실제로 지고 있는 것이 이쪽이라는 관측이며 축 논증과 같은 방향이다. 통합 후 이 상수의 감도는 **올라간다**. 두 상수의 +20% 가 모두 0% 였던 것은 서로가 서로를 가려 주었기 때문이고, 가림이 사라진 것이지 회귀가 아니다."
    },
    {
      "key": "affordability.buffer_ratio",
      "engine": "affordability",
      "legacy_symbol": "BUFFER_RATIO",
      "spec_class": "d",
      "value_type": "ratio",
      "frozen_current_value": 0.1,
      "spec_action": "준거 없음. 우리 선택 명시.",
      "seed_provenance": {
        "source_kind": "normative",
        "source_name": null,
        "source_ref": null,
        "observed_at": null,
        "fetched_at": null,
        "verification": "our_choice"
      }
    },
    {
      "key": "affordability.net_income_from_annual",
      "engine": "affordability",
      "legacy_symbol": "NET_INCOME_FROM_ANNUAL",
      "spec_class": "a",
      "value_type": "ratio",
      "frozen_current_value": 0.85,
      "spec_action": "상수 삭제. 법정 산식 함수로 대체 (1-②).",
      "slated_for_removal": "1-②. 4대보험 요율 + 근로소득 간이세액표 기반 함수로 교체된다.",
      "pending_diligence": "근로소득 간이세액표의 개정일·적용 지급분 시점 (4대보험 요율 4종은 원문확인 완료)",
      "seed_provenance": {
        "source_kind": "statute",
        "source_name": null,
        "source_ref": null,
        "observed_at": null,
        "fetched_at": null,
        "verification": "unverified"
      },